,PMID,abstract
426,32563846,"In the multi-site Prescription Opioid Addiction Treatment Study (POATS), the best predictor of successful opioid use outcome was lifetime diagnosis of major depressive disorder. The primary aim of this secondary analysis of data from POATS was to empirically assess two explanations for this counterintuitive finding."
427,32580180,A dual-ended readout PET detector based on two Hamamatsu 16 × 16 arrays of 1 × 1 mm
428,32585419,"The United States is facing a ""triple wave"" epidemic fueled by novel synthetic opioids. Cryptomarkets, anonymous marketplaces located on the deep web, play an increasingly important role in the distribution of illicit substances. This article presents the data collected and processed by the eDarkTrends platform concerning the availability trends of novel synthetic opioids listed on one cryptomarket."
429,32586121,Small bowel bleeding (SBB) accounts for 5%-10% of all cases of acute gastrointestinal bleeding. Transcatheter arterial embolization (TAE) plays an important role in the treatment of SBB.
430,32586137,"Safe and reliable healthcare depends on access to health information that is accurate, valid, reliable, timely, relevant, legible and complete. National data collections are repositories of health and social care data and play a crucial role in healthcare planning and clinical decision-making. We describe the development of an evidence-informed multi-method quality improvement program aimed to improve the quality of health and social care data in Ireland. Specific components involved: development of guidance to support implementation of health information standards; review program to assess compliance with standards; and educating health information stakeholders about health data and information quality. Observations from implementation of the program indicate enhanced health information stakeholder awareness of, and increased adoption of information management standards. The methodology used in the review program has proved to be a robust approach to identify areas of good practice and opportunities for improvement in information management practices. There has been positive adoption of the program among organisations reviewed and acceptance of the proposed recommendations. Early indications are that this multi-method approach will drive improvements in information management practices, leading to an improvement in health and social care data quality in Ireland. Aspects of this approach may be adapted to meet the needs of other countries."
431,32586162,"While patients with angiogram-negative subarachnoid hemorrhages (ANSAH) have better prognoses than those with aneurysmal SAH, frailty's impact on outcomes in ANSAH is unclear. We previously showed that the modified frailty index (mFI-11) is associated with poor outcomes following ANSAH. Here, we compared the mFI-5, mFI-11, Charlson Comorbidity Index (CCI), and temporalis thickness (TMT) to determine which index was the best predictor of ANSAH outcomes and mortality rates."
432,32590210,"Having more than one drug use disorders (DUDs) is an increasing public health concern, but it has been understudied. The goal of this study is to investigate the prevalence and patterns of coexisting DUD diagnoses among inpatient hospitalizations due to DUD in the United States."
433,32593152,"While substance use can lead to incarceration, the disruptive effects of incarceration may lead to, or increase psychosocial vulnerability and substance use. Using causal inference methods, we measured longitudinal associations between incarceration and post-release substance use among Black men who have sex with men (BMSM), populations facing disproportionate risk of incarceration and substance use."
434,32599494,"Binge drinking is common during college, and studies have shown that many college students drink in quantities that far exceed the standard binge drinking threshold. Previous research has noted personality differences in individuals who engage in binge drinking, but few studies have examined neurobiological differences in both standard bingers (4/5 drinks in two hours for females/males; sBinge) and extreme binge drinkers (8+/10+ drinks in two hours for females/males; eBinge)."
435,32599567,"Atomic force microscopy (AFM) belongs to the high resolution and high sensitivity surface imaging technologies. In this method force interactions between the tip and the surface are observed to characterize sample properties. In the so-called contact AFM (C AFM) mode the tip is brought into continuous contact with the sample. Significant progress in the AFM technology can be obtained, when the so-called active cantilever technology is implemented in the surface measurements. The built-in deflection actuator enables very precise excitation of the cantilever. Moreover, as the mass of the beam is very small the static beam displacement can be controlled in the wide frequency range. In the experiments, which we describe in this article, we applied the so called active electromagnetic cantilevers. They integrate a conductive loop which, when immersed in the magnetic field and biased with electric current, acts as an electromagnetic deflection actuator. The induced and precisely estimated Lorentz force, which is a function of bias current, cantilever geometry and magnetic field makes the cantilever deflect. Moreover, the probe stiffness can be calibrated with lower uncertainty as in the case of standard thermomechanical analysis. NZ AFM technology required application of a novel control algorithm, called PredPID, in which the cantilever bending caused by a proportional-integral-derivative (PID) block maintaining the constant load force was predicted."
436,32601441,"The HIV-1 envelope glycoprotein (Env) trimer, composed of gp120 and gp41 subunits, mediates viral entry into cells. Recombinant Env trimers have been studied structurally, but characterization of Env embedded in intact virus membranes has been limited to low resolution. Here, we deploy cryo-electron tomography and subtomogram averaging to determine the structures of Env trimers on aldrithiol-2 (AT-2)-inactivated virions in ligand-free, antibody-bound and CD4-bound forms at subnanometer resolution. Tomographic reconstructions document molecular features consistent with high-resolution structures of engineered soluble and detergent-solubilized Env trimers. One of three conformational states previously predicted by smFRET was not observed by cryo-ET, potentially owing to AT-2 inactivation. We did observe Env trimers to open in situ in response to CD4 binding, with an outward movement of gp120-variable loops and an extension of a critical gp41 helix. Overall features of Env trimer embedded in AT-2-treated virions appear well-represented by current engineered trimers."
437,32610170,"Chemotherapy-induced alopecia is psychologically challenging for patients undergoing cancer treatment, and scalp cooling has been shown to prevent or decrease the hair loss."
438,32611461,"In this time of Covid-19, life in healthcare has changed immeasurably. It has rapidly been injected with an 'all hands-on deck' approach, to facilitate the necessary adaptations required to reduce the spread of the virus and deliver frontline clinical care. Inevitably aspects of these changes have disrupted the delivery of medical education, notably clinical placements have been cancelled and social distancing guidelines prohibit face-to-face teaching. The training of future doctors is an essential part of this effort. Indeed, the emergence of a global health threat has underlined its continued importance. For medical educators and students alike, we have been presented with a challenge. Concurrently, this presents us with an impetus and opportunity for innovation. For some time now, a transformation in medical education has been called for, with an increasing recognition of the need to prepare students for the changing landscape of healthcare systems. This has included a focus on the use of technology-enhanced and self-directed learning. As a team of educators and clinicians in psychiatry, working in the School of Medicine and Medical Sciences (SMMS) in University College Dublin (UCD), we will share how we have responded. We outline the adaptations made to our 'Psychiatry' module and consider the influence this may have on its future delivery. These changes were informed by direct student input."
439,32611470,"Youth mental health is a rapidly developing field with a focus on prevention, early identification, treatment innovation and service development. In this perspective piece, we discuss the effects of COVID-19 on young people's mental health. The psychosocial effects of COVID-19 disproportionately affect young people. Both immediate and longer-term factors through which young people are affected include social isolation, changes to the delivery of therapeutic services and almost complete loss of all structured occupations (school, work and training) within this population group. Longer-term mechanisms include the effects of the predicted recession on young people's mental health. Opportunities within this crisis exist for service providers to scale up telehealth and digital services that may benefit service provision for young people's mental health in the future."
440,32611473,"The COVID-19 pandemic has posed many challenges in maintaining standards of care and treatment for patients while managing the increased anxieties of patients, carers and the public in general. This paper highlights several clinical, administrative, medicolegal and IT implications of COVID-19 on the delivery of mental healthcare to an elderly vulnerable patient cohort due to recommended social distancing measures. Our Psychiatry of Later Life team has adapted to this by restricting face-to-face consultation, while continuing to provide telephone support. We have modified our documentation standard and have improved some aspects of our team working by facilitating flexible working arrangement and relevant training for staff as well as by embracing new technology. Notwithstanding the challenges therefore, this exceptional time has also opened avenues for new and innovative opportunities that can be further explored even when the current crisis eventually passes."
441,32623869,"Rheumatic manifestations are the most frequent extra-intestinal manifestations (EIMs) in inflammatory bowel disease (IBD) patients, and they are responsible for a relevant reduction of quality of life. IBD is associated with a variety of musculoskeletal manifestations such as arthritis and non-inflammatory pain as well as with metabolic diseases, such as osteoporosis. Different imaging techniques (primarily ultrasound, magnetic resonance imaging and X-rays) can help the clinician to correctly identify the nature of manifestations and to treat the patient accordingly. Nowadays, in the setting of IBD-related arthritides, different drugs are available and can be effective on both articular and intestinal involvement. Therefore, a multi-disciplinary approach provides an early diagnosis and a better clinical outcome that can only be given from the recognition and consideration of the different EIMs. As for rheumatic manifestations, namely IBD-related arthritis, an early intervention allows to control disease activity and to prevent structural damage."
442,32623873,"Nowadays irritable bowel syndrome (IBS) and lactose intolerance (LI) are two very frequent diseases. IBS is a functional disorder, while LI is caused by the inability to digest lactose. LI is often incorrectly diagnosed as IBS. The aim of our study is to identify LI patients among IBS patients, so as to set up a correct therapy."
443,32628804,"Perfluorocarbons, saturated carbon chains in which all the hydrogen atoms are replaced with fluorine, form a separate phase from both organic and aqueous solutions. Though perfluorinated compounds are not found in living systems, they can be used to modify biomolecules to confer orthogonal behavior within natural systems, such as improved stability, engineered assembly, and cell-permeability. Perfluorinated groups also provide handles for purification, mass spectrometry, and "
444,32647103,"Many physiological signals are degraded by significant corruptions that limit their usefulness. One example is cerebral blood flow velocity (CBFV) signals, measured by transcranial Doppler, which are susceptible to large errors from patient motion. In this paper, we propose a method to remove artifacts and impute sections of missing data in these signals."
445,32652524, Intrathoracic neurogenic tumors (INTs) are uncommon neoplasms arising from nerve tissues. We report our single-center experience in treating these rare INTs.
446,32658802,"To describe the nature, associated risk factors and age of diagnosis for childhood hearing loss in a South African cohort from the Western Cape Province."
447,32666866,"This systematic review and meta-analysis aimed to critically evaluate and summarise all available evidence derived from randomised clinical trials (RCTs) regarding aromatherapy's effects on labour pain and anxiety relief. Literature search was performed in MEDLINE/PubMed, Cochrane library, Cochrane Central Register of Controlled Trials (CENTRAL) and Scopus since their respective inception to January 2019. Additionally, Google Scholar was also searched to explore citations of eligible final studies which were subsequently included in the systematic review. The search strategy used was: (pregnancy or pregnant or prenatal or antenatal or perinatal or maternal) AND (aromatherapy or essential oils or aroma therapy). Per inclusion and exclusion criteria established by the current study, nine RCTs were included in the systematic review. Results from the current study suggested that aromatherapy significantly decreased pain and anxiety in the first stage of labour.IMPACT STATEMENT"
448,32675537,There is limited evidence for the use of postoperative antibiotics for simple appendicitis (SA) in children. Our aim was to conduct a prospective double-blinded randomized controlled trial to investigate this after a laparoscopic appendicectomy.
449,32677416,"The mechanisms of chronic hepatitis C virus (HCV)-induced liver fibrosis and hepatocarcinogenesis are still poorly recognized. Therefore, this study aimed to determine the effect of chronic HCV infection on the expression of the major regulators of epithelial-mesenchymal transition (EMT) including E-cadherin, Snail, Slug, and Twist2, in the Egyptian population. This will help to design more efficient strategies to treat HCV-associated cirrhosis and carcinoma."
450,32675548,"Systemic inflammation via host-tumor interactions is currently recognized as a hallmark of cancer. The aim of this study was to evaluate the prognostic value of various combinations of inflammatory factors using preoperative blood, and to assess the clinical significance of our newly developed inflammatory score in colorectal cancer (CRC) patients."
451,32677418,"Inflammatory bowel diseases (IBD), that includes ulcerative colitis and Crohn's disease, can affect not only the gastrointestinal tract but a wide spectrum of organs. The extra-intestinal manifestations (EIMs) are one of the most challenging aspect of IBD, playing a significant role for the lifetime care and the quality of life of patients. Ocular manifestations are the third most frequent EIMs, preceded by articular and dermatological ones. The aim of this narrative review is to describe the different types of ocular involvements, focusing on their clinical management. Uveitis and episcleritis are the most common ocular EIMs, differing for many aspects. Uveitis are unrelated with IBD activity and they even precede the onset of the intestinal disease, while episcleritis are common defined as a good mark of IBD activity. Pain is uncommon in most cases of episcleritis, while severe eye pain and photophobia are the most frequent onset of anterior uveitis. Less common but even more severe, are orbital pseudotumor or posterior segment involvement. Most of the ocular EIMs can be successfully treated with topic and oral steroids and the underlying therapy for IBD can reduce or cut out at all the recurrence of these manifestations. Symptoms are commonly not specific, in some cases being unnoticed for years leading to permanent ocular consequences. Cooperation between different specialists is crucial to avoid all the possible consequences of a non-treated EIMs, especially for ocular ones."
452,32677419,"Small bowel capsule endoscopy (SBCE) was introduced into clinical practice almost 20 years ago and, nowadays, it is an essential tool for the study of the small bowel. SBCE allows a radiation-free examination of the entire mucosal surface of the small bowel with high-quality images, limited invasivity and a good safety profile. Nevertheless, the main limitation of SBCE is the lack of any possible direct therapeutic intervention. Indications for SBCE have evolved throughout the years, from ""old"" ones such as suspected small bowel bleeding (still the main indication for SBCE) to newer ones such as refractory celiac disease, hereditary polyposis syndromes and Crohn's disease. Thus, nowadays SBCE has a key role in the diagnostic algorithms in many conditions. Furthermore, the introduction in the SBCE field of cutting-edge technologies, as artificial intelligence systems, is likely to shorten the reading time making SBCE even more effective and easy to perform. Preliminary data are extremely promising and solid evidence is being gathered by current studies."
453,32677420,"Focal liver lesions (FLLs) are a common finding during routine abdominal ultrasound (US). The differential diagnosis between diverse types of FLLs, especially between benign and malignant ones, is extremely important and can often be particularly challenging. Radiological techniques with contrast administration and/or liver biopsy are mostly necessary for establishing diagnosis, but they have several contraindications or complications. Due to limitations of these tools, there is urgent and still unmet need to develop a first line, non-invasive and simple method to diagnose FLLs. Elastography is an US-based imaging modality that provides information about the physical parameter corresponding to the tissue stiffness and can be considered a virtual biopsy. Several elastographic approaches have been developed, such as transient elastography, strain imaging and share wave imaging, which include point shear wave elastography and 2D shear wave elastography. These tools are already in use for evaluating liver fibrosis and in the assessment of focal lesions in other organs, like breast and thyroid gland. This review aims to assess the current evidence of different techniques based on elastography in the setting of FLLs, in order to evaluate accuracy, limitations and future perspectives. In particular, we focused on two contexts: the ability of discriminating between benign and malignant lesions, especially hepatocellular carcinoma and liver metastasis, and the surveillance after percutaneous therapy. This could have a high clinical impact making elastography crucial to identify the appropriate management of FLLs."
454,32677777,"Laparoscopy is a surgical procedure that has been used widely in medicine over the last thirty years. In gynecology, laparoscopy is the ""gold standard"" for the majority of gynecological procedures, as its superiority over laparotomy has been widely demonstrated. In recent years, the current trend of gynecologists is to make laparoscopy surgery even less invasive by reducing the number of incisions in the skin, as it happens with laparoendoscopic single-site surgery, or by reducing the size of them as in mini-laparoscopy. The aim of this work was to perform an extensive review and update of the evolution of single-port surgery and mini-laparoscopic surgery in gynecology as well as to evaluate its current role in this field."
455,32680662,Harvesting partial thickness skin grafts is an important technical skill the training plastic surgeon is required to hone. Historically accomplished via manual dermatome (Humby's knife) or the modern day electric dermatome.
456,32690332,"IThe incidence of burns in pregnancy is very low, therefore little is confirmed in the specific management of pregnant women who are burned."
457,32691638,"This study tests coverage of SNOMED CT as an expansion source in the process of automated expansion of clinical terms found in discharge summaries. Term expansion is commonly used as a technique in knowledge extraction, query formulation and semantic modelling among other applications. However, characteristics of the sources might affect credibility of outputs, and coverage is one of them."
458,32690600,"Although severe acute respiratory syndrome coronavirus 2 (SARS-CoV-2) RNA was detected in faeces of patients with COVID-19, the activity and infectivity of the virus in the GI tract during disease course is largely unknown. We investigated temporal transcriptional activity of SARS-CoV-2 and its association with longitudinal faecal microbiome alterations in patients with COVID-19."
459,32702197,We aimed to investigate the impact of applying the 2019 European Alliance of Associations for Rheumatology (EULAR)/American College of Rheumatology (ACR) classification criteria for systemic lupus erythematosus (SLE) in a previously described cohort of women with undifferentiated connective tissue disease (UCTD).
460,32715929,"This study aims at exploring human error in an airport control tower through the technique for the retrospective and predictive analysis of cognitive error (TRACEr) and the controller action reliability assessment (CARA) method. Despite the presence of automated safety nets, air traffic control (ATC) is heavily dependent upon the capabilities of humans. A number of ATC-relevant accidents were characterized by human errors. The data related to error dimensions were collected through interview and direct observation. Then, human error probability and error-producing conditions were evaluated by the CARA method. The results showed that selection and quality, memory, distraction/preoccupation, and traffic and airspace have the highest percentage error rates. Furthermore, the results indicated that the highest probability of error was associated with emergency situation management. This study is the first research to classify and quantify human errors using the TRACEr and the CARA method to evaluate controller error in ATC."
461,32720802,"Genitourinary syndrome of menopause (GSM) may affect up to 90% of menopausal women, including vulvovaginal atrophy (VVA), burning, pain, bleeding, irritation, dyspareunia, anorgasmia, and urinary symptoms. Vaginal symptoms from lack of estrogens can have a significant impact on the sexual health and quality of life (QoL) in as many as 50% of postmenopausal women. Several therapeutic alternatives, both hormonal and non- hormonal, have been proposed. Microablative CO<inf>2</inf> laser is one of the three non-surgical energy-based therapies, with Erbium:YAG laser and temperature-controlled radiofrequency (RF). Microablative CO<inf>2</inf> laser induces morphological changes in vaginal tissues and results of several clinical trials suggest that this type of laser improves symptoms of GSM. Moreover, this treatment seems to be safe. Given the increasingly widespread use of laser CO<inf>2</inf> as a non-hormonal alternative treatment for GSM, the authors reviewed the current published literature evaluating this therapy, to compare efficacy and safety of different protocols."
462,32721634,"The CBM complex, which is composed of the proteins CARMA1, BCL10, and MALT1, serves multiple pivotal roles as a mediator of T-cell receptor and B-cell receptor-dependent NF-κB induction and lymphocyte activation. CARMA1, BCL10, and MALT1 are each proto-oncoproteins and dysregulation of CBM signaling, as a result of somatic gain-of-function mutation or chromosomal translocation, is a hallmark of multiple lymphoid malignancies including Activated B-cell Diffuse Large B-cell Lymphoma. Moreover, loss-of-function as well as gain-of-function germline mutations in CBM complex proteins have been associated with a range of immune dysregulation syndromes. A wealth of detailed structural information has become available over the past decade through meticulous interrogation of the interactions between CBM components. Here, we review key findings regarding the biochemical nature of these protein-protein interactions which have ultimately led the field to a sophisticated understanding of how these proteins assemble into high-order filamentous CBM complexes. To date, approaches to therapeutic inhibition of the CBM complex for the treatment of lymphoid malignancy and/or auto-immunity have focused on blocking MALT1 protease function. We also review key studies relating to the structural impact of MALT1 protease inhibitors on key protein-protein interactions."
