,PMID,abstract
596,33094812,"Tropomyosin receptor kinase B (Trk-B) belongs to the second largest family of membrane receptors, Receptor Tyrosine Kinases (RTKs). Trk-B is known to interact with three different neurotrophins: Brain-Derived Neurotrophic Factor (BDNF), Neurotrophin-4 (NT-4), and Neurotrophin-3 (NT-3). All three neurotrophins are involved in survival and proliferation of neuronal cells, but each induces distinct signaling through Trk-B. We hypothesize that the different biological effects correlate with differences in the interactions between the Trk-B receptors, when bound to different ligands, in the plasma membrane. To test this hypothesis, we use quantitative FRET to characterize Trk-B dimerization in response to NT-3 and NT-4 in live cells, and compare it to the previously published data for Trk-B in the absence and presence of BDNF. Our study reveals that the distinct Trk-B signaling outcomes are underpinned by both different configurations and different stabilities of the three ligand-bound Trk-B dimers in the plasma membrane."
597,33098949,To evaluate the efficacy and safety of intra-articular mesenchymal stromal cells (MSCs) injections for knee osteoarthritis (OA) treatment.
598,33100160,"Femtosecond photoexcitation of semiconducting materials leads to the generation of coherent acoustic phonons (CAPs), the behaviours of which are linked to intrinsic and engineered electronic, optical and structural properties. While often studied with pump-probe spectroscopic techniques, the influence of nanoscale structure and morphology on CAP dynamics can be challenging to resolve with these all-optical methods. Here, we used ultrafast electron microscopy (UEM) to resolve variations in CAP dynamics caused by differences in the degree of crystallinity in as-prepared and annealed GaAs lamellae. Following "
599,33100161,"We review the use of transmission electron microscopy (TEM) and associated techniques for the analysis of beam-sensitive materials and complex, multiphase systems "
600,33100164,Progress is reported in analytical 
601,33103408,"Urinary incontinence is a common condition that negatively impacts quality of life of millions of women. It is a result of a synergy between the structures of pelvic floor in particular levator ani muscle and pelvic connective tissues. Urinary incontinence, increasing with age, is associated with considerable personal and societal expenditure."
602,33109568,"Neoadjuvant concurrent chemoradiotherapy (CCRT) is the standard therapeutic strategy for rectal cancer. However, 15-20% of patients undergoing neoadjuvant CCRT progress to recurrence or distant metastases. Therefore, identifying a predictive biomarker is necessary for treating CCRT."
603,33115610,"Cancer will directly affect the lives of over one-third of the population. The DNA Damage Response (DDR) is an intricate system involving damage recognition, cell cycle regulation, DNA repair, and ultimately cell fate determination, playing a central role in cancer etiology and therapy. Two primary therapeutic approaches involving DDR targeting include: combinatorial treatments employing anticancer genotoxic agents; and synthetic lethality, exploiting a sporadic DDR defect as a mechanism for cancer-specific therapy. Whereas, many DDR proteins have proven ""undruggable"", Fragment- and Structure-Based Drug Discovery (FBDD, SBDD) have advanced therapeutic agent identification and development. FBDD has led to 4 (with ∼50 more drugs under preclinical and clinical development), while SBDD is estimated to have contributed to the development of >200, FDA-approved medicines. Protein X-ray crystallography-based fragment library screening, especially for elusive or ""undruggable"" targets, allows for simultaneous generation of hits plus details of protein-ligand interactions and binding sites (orthosteric or allosteric) that inform chemical tractability, downstream biology, and intellectual property. Using a novel high-throughput crystallography-based fragment library screening platform, we screened five diverse proteins, yielding hit rates of ∼2-8% and crystal structures from ∼1.8 to 3.2 Å. We consider current FBDD/SBDD methods and some exemplary results of efforts to design inhibitors against the DDR nucleases meiotic recombination 11 (MRE11, a.k.a., MRE11A), apurinic/apyrimidinic endonuclease 1 (APE1, a.k.a., APEX1), and flap endonuclease 1 (FEN1)."
604,33125339,"Physical activity and sports can be used to reduce stress and anxiety by increasing aerobic capacity and muscle endurance, gain positive behavioral changes and improve their self-discipline, use time well, adopt positive lifestyle such as regular eating and sleeping, which will result in an increase in school success. There are no comprehensive study that examines the academic performance of licensed student athletes and the factors influencing their success rates. The aim of this study was to evaluate the academic performance and related factors in licensed athletes."
605,33125468,"This review takes an inclusive approach to microvascular dysfunction in diabetes mellitus and cardiometabolic disease. In virtually every organ, dynamic interactions between the microvasculature and resident tissue elements normally modulate vascular and tissue function in a homeostatic fashion. This regulation is disordered by diabetes mellitus, by hypertension, by obesity, and by dyslipidemia individually (or combined in cardiometabolic disease), with dysfunction serving as an early marker of change. In particular, we suggest that the familiar retinal, renal, and neural complications of diabetes mellitus are late-stage manifestations of microvascular injury that begins years earlier and is often abetted by other cardiometabolic disease elements (eg, hypertension, obesity, dyslipidemia). We focus on evidence that microvascular dysfunction precedes anatomic microvascular disease in these organs as well as in heart, muscle, and brain. We suggest that early on, diabetes mellitus and/or cardiometabolic disease can each cause reversible microvascular injury with accompanying dysfunction, which in time may or may not become irreversible and anatomically identifiable disease (eg, vascular basement membrane thickening, capillary rarefaction, pericyte loss, etc.). Consequences can include the familiar vision loss, renal insufficiency, and neuropathy, but also heart failure, sarcopenia, cognitive impairment, and escalating metabolic dysfunction. Our understanding of normal microvascular function and early dysfunction is rapidly evolving, aided by innovative genetic and imaging tools. This is leading, in tissues like the retina, to testing novel preventive interventions at early, reversible stages of microvascular injury. Great hope lies in the possibility that some of these interventions may develop into effective therapies."
606,33130063,Nothing is known about the mechanisms by which increased ceramide levels in the lung contribute to allergic responses and asthma severity.
607,33135072,"It is a common practice in epigenetics research to profile DNA methylation on tissue samples, which is usually a mixture of different cell types. To properly account for the mixture, estimating cell compositions has been recognized as an important first step. Many methods were developed for quantifying cell compositions from DNA methylation data, but they mostly have limited applications due to lack of reference or prior information."
608,33136296,"Supportive care interventions have demonstrated benefits for both informal and/or family cancer caregivers and their patients, but uptake generally is poor. To the authors' knowledge, little is known regarding the availability of supportive care services in community oncology practices, as well as engagement practices to connect caregivers with these services."
609,33140622,"Alcohol-related liver disease is one of the most prevalent liver diseases worldwide and is the second most common indication for liver transplantation. Most transplant programs require 6 months of abstinence prior to transplantation; commonly referred to as the ""six-month rule."" According to this rule, the patients admitted for severe acute alcoholic hepatitis are not eligible for liver transplantation in most transplant centers. However, there is increasing evidence that if liver transplantation is performed in selected patients after the first episode of severe decompensation with no response to steroid therapy, it represents an effective treatment. In such selected patients, the post-transplant outcomes are good with survival rates that are significantly higher when compared with patients not responding to medical therapy and not transplanted. A multidisciplinary assessment, involving several stakeholders such as a transplant hepatologist, transplant surgeon, psychologist and psychiatrist is becoming mandatory to properly evaluate the candidate to liver transplantation for alcoholic liver diseases and severe acute alcoholic hepatitis. In the clinical setting of severe acute alcoholic hepatitis, further studies are needed for the identification of accepted selection clinical and psychosocial criteria that can provide the best long-term results. The early liver transplantation option should therefore be explored within strict criteria for this setting."
610,33140623,"Portal hypertension is a clinical syndrome characterized by an increase in the portal pressure gradient, defined as the gradient between the portal vein at the site downstream of the site of obstruction and the inferior vena cava. The most frequent cause of portal hypertension is cirrhosis. In patients with cirrhosis, portal hypertension is the main driver of cirrhosis progression and development of hepatic decompensation (ascites, variceal hemorrhage and hepatic encephalopathy), which defines the transition from compensated to decompensated stage. In decompensated patients, treatments aim at lowering the risk of death by preventing further decompensation and/or development of acute-on-chronic liver failure. Decompensated patients often pose a complex challenge which typically requires a multidisciplinary approach. The aims of the present review were to discuss the current knowledge regarding interventional treatments for patients with portal hypertension complications as well as to highlight useful information to aid hepatologists in their clinical practice. Specifically, we discussed the indications and contraindications of transjugular intra-hepatic portosystemic shunt and for the treatment of gastro-esophageal variceal hemorrhage in patients with decompensated cirrhosis (first section); we reviewed the use of interventional treatments in patients with hepatic vein obstruction (Budd-Chiari Syndrome) and in those with portal vein thrombosis (second section); and we briefly comment on the most frequent applications of selective splenic embolization in patients with and without underlying cirrhosis (third section)."
611,33138111,"Many bacteria require flagella for the ability to move, survive, and cause infection. The flagellum is a complex nanomachine that has evolved to increase the fitness of each bacterium to diverse environments. Over several decades, molecular, biochemical, and structural insights into the flagella have led to a comprehensive understanding of the structure and function of this fascinating nanomachine. Notably, X-ray crystallography, cryo-electron microscopy (cryo-EM), and cryo-electron tomography (cryo-ET) have elucidated the flagella and their components to unprecedented resolution, gleaning insights into their structural conservation and adaptation. In this review, we focus on recent structural studies that have led to a mechanistic understanding of flagellar assembly, function, and evolution."
612,33140628,"The aim of our systematic review was the assessment of effects of excisional treatments for the management of cervical intraepithelial neoplasia (CIN) on preterm delivery (PD), lower birth weight (LBW), preterm premature rupture of membrane (PPROM) and obstetrical outcomes."
613,33140994,To evaluate the safety and efficacy of a digital therapeutic in treatment-seeking individuals with opioid use disorder (OUD) in an analysis of randomized clinical trial (RCT) data (ClinicalTrials.gov identifier: NCT00929253).
614,33143989,"Bromelain-based enzymatic debridement has emerged as an alternative to surgical eschar removal. Indications include partial thickness, mixed pattern, and full-thickness burns. Enzymatic debridement has been approved by the European Medicines Agency for treating burn wounds affecting <15% total body surface area (TBSA). Data and evidence for the treatment of areas >15% TBSA in one session is scarce. The aim of this retrospective study was to retrospectively analyze off-label use of enzymatic debridement in a single burn center for large TBSA burns."
615,33145662,"This essay argues that Berger and Mohr's A Fortunate Man (1967) - comprising social observation and photographs of the rural practitioner, Dr. Sassall and his patients - enacts an embodied, intersubjective empathy called ""pain-work."" The book enacts ""pain-work"" through two strategies. Firstly, by conflating three ways of seeing - Berger's observation, Mohr's photography, and Sassall's medical gaze - it shows that the clinical encounter embodies objective vision through intersubjective pain. Secondly, it employs the concepts of recognition and witnessing to show how the subjectivity of the physician is distributed in his community. Thus, Berger and Mohr witness Sassall's witnessing of his patients; even as Sassall and his patients are constituted intersubjectively, so too are Berger, Mohr, and Sassall."
616,33146344,"This article reviews the most common non-psychiatric comorbidities associated with affective disorders, examining the implications of their possible bidirectional link. A narrative review was conducted on the association among the three most common non-psychiatric diseases in major depressive disorder and bipolar disorder (obesity, metabolic syndrome, and cardiovascular diseases) in articles published from January 1994 to April 2020. The evidence suggests that obesity, metabolic syndrome, and cardiovascular diseases are highly prevalent in patients diagnosed with affective disorders. The presence of non-psychiatric comorbidities significantly worsens the therapeutic management and prognosis of affective disorders and vice versa. In many cases, these comorbidities may precede the onset of affective disorders, although in most cases they appear after it. The presence of these concurrent non-psychiatric diseases in an individual diagnosed with an affective disorder is associated with a more complex disease presentation and management. For professionals, the evidence unequivocally supports routine surveillance of comorbidities from a multidisciplinary approach."
617,33153744,"Currently, the apparition of new SARS-CoV, known as SARS-CoV-2, affected more than 34 million people and causing high death rates worldwide. Recently, several studies reported SARS-CoV-2 ribonucleic acid (RNA) in hospital wastewater. SARS-CoV-2 can be transmitted between humans via respiratory droplets, close contact and fomites. Fecal-oral transmission is considered also as a potential route of transmission since several scientists confirmed the presence of SARS-CoV-2 RNA in feces of infected patients, therefore its transmission via feces in aquatic environment, particularly hospital wastewater. Hospitals are one of the important classes of polluting sectors around the world. It was identified that hospital wastewater contains hazardous elements and a wide variety of microbial pathogens and viruses. Therefore, this may potentially pose a significant risk of public health and environment infection. This study reported an introduction about the Physical-chemical and microbiological characterization of hospital wastewater, which can be a route to identify potential technology to reduce the impact of hospital contaminants before evacuation. The presence of SARS-CoV-2 in aqueous environment was reviewed. The knowledge of the detection and survival of SARS-CoV-2 in wastewater and hospital wastewater were described to understand the different routes of SARS-CoV-2 transmission, which is also useful to avoid the outbreak of CoV-19. In addition, disinfection technologies used commonly for deactivation of SARS-CoV-2 were highlighted. It was revealed that, chlorine-containing disinfectants are the most commonly used disinfectants in this field of research. Meanwhile, other efficient technologies must be developed and improved to avoid another wave of the pandemic of COVID-19 infections."
618,33150398,"The discovery of leptin was intrinsically associated with its ability to regulate body weight. However, the effects of leptin are more far-reaching and include profound glucose-lowering and anti-lipogenic effects, independent of leptin's regulation of body weight. Regulation of glucose metabolism by leptin is mediated both centrally and via peripheral tissues and is influenced by the activation status of insulin signaling pathways. Ectopic fat accumulation is diminished by both central and peripheral leptin, an effect that is beneficial in obesity-associated disorders. The magnitude of leptin action depends upon the tissue, sex, and context being examined. Peripheral tissues that are of particular relevance include the endocrine pancreas, liver, skeletal muscle, adipose tissues, immune cells, and the cardiovascular system. As a result of its potent metabolic activity, leptin is used to control hyperglycemia in patients with lipodystrophy and is being explored as an adjunct to insulin in patients with type 1 diabetes. To fully understand the role of leptin in physiology and to maximize its therapeutic potential, the mechanisms of leptin action in these tissues needs to be further explored."
619,33155039,Single-cell RNA sequencing is the reference technique for characterizing the heterogeneity of the tumor microenvironment. The composition of the various cell types making up the microenvironment can significantly affect the way in which the immune system activates cancer rejection mechanisms. Understanding the cross-talk signals between immune cells and cancer cells is of fundamental importance for the identification of immuno-oncology therapeutic targets.
620,33161698,"Although uncommon during hepatobiliary-pancreatic (HBP) surgery, iatrogenic intraoperative injury to a major artery requires prompt and appropriate repair. Here, we outline our surgical experience with the repair of this injury and compare our experience to findings garnered from a selective review of the literature."
621,33161699,The aim of this study was to evaluate the impact of surgeons' learning curve in robotic surgery for rectal cancer on circumferential resection margin (CRM) involvement and reoperation rates.
622,33161700,"Morbid Obesity is increasing worldwide at fast pace with associated co-morbidities also on the rise. Considering that Obesity is one of the main risk factors for developing a Ventral Hernia this will results that in the future we will experience a rise in those hernia in patients undergoing any abdominal surgery. There is no clarity on the best timing and choice for procedures. We are well aware also on the difficulties in hernia repair surgery and the relative outcome so adding obesity as co-factors amplify the challenges. In fact, today both general surgeons with expertise in abdominal wall repair and bariatric surgeons are faced with a new dilemma: the obese patient with an abdominal wall hernia. This article will briefly review the impact of obesity on the natural history of hernia, its associated complication, management strategies and outcome."
623,33161701,Laparoscopic sleeve gastrectomy (LSG) has gained worldwide popularity in the last 10 years as self alone bariatric procedure. Symptomatic stenosis (SS) is a potential severe postoperative complication and it can be divided in organic stenosis (OS) and functional stenosis (FS). The aim of this paper is to propose a modified surgical technique to prevent FS.
624,33162141,"We aimed to examine the impact of weather on COVID-19 confirmed cases in South Asian countries, namely, Afghanistan, Bangladesh, India, Pakistan, and Sri Lanka. Data on daily confirmed cases, together with weather parameters, were collected from the first day of COVID confirmed cases in each country to 31 August 2020. The weather parameters were Rainfall (mm), relative humidity (%), maximum and minimum temperature (°C), surface pressure (kPa), maximum air pollutants matter PM 2.5 (μg/m"
625,33162149,"According to the latest reports, severe acute respiratory syndrome coronavirus 2 (SARS-CoV-2), which caused coronavirus disease 2019 (COVID-19), was successfully isolated from the excreta (stool and urine) of COVID-19 patients, suggesting SARS-CoV-2 could be transmitted through excreta contaminated water. As pit latrines and the use of untreated excreta as fertilizer were common in rural China, we surveyed 27 villages of Jiangxi and Hubei provinces and found that pit latrines could be a potential source of SARS-CoV-2 water pollution. Recently, bats have been widely recognized as the source of SARS-CoV-2. There were many possible intermediate hosts of SARS-CoV-2, including pangolin, snake, bird and fish, but which one was still not clear exactly. Here, we proposed a hypothesis to illustrate the mechanism that SARS-CoV-2 might spread from the excreta of infected humans in pit latrines to potential animal hosts, thus becoming a sustainable source of infection in rural China. Therefore, we believe that abolishing pit latrines and banning the use of untreated excreta as fertilizer can improve the local living environment and effectively prevent COVID-19 and other potential waterborne diseases that could emanate from the excreta of infected persons. Although this study focused on rural areas in China, the results could also be applied to low-income countries, especially in Africa."
626,33162413,"A simple visual strategy was developed for the RNase H colorimetric measurement using DNAzyme-mediated signal amplification. When RNase H was presented, the RNA strand of the duplex formed by the G-rich DNA sequence (G-Rich) and its complementary RNA sequence (cp-RNA) was digested, releasing G-Rich to form HRP-mimicking DNAzymes of the G-quadruplex/hemin complexes in the presence of hemin. These DNAzymes catalyze the oxidation reaction of the substrate of 2,2'-azino-bis(3-ethylbenzothiazoline-6-sulfonic acid) (ABTS) to produce green-color products of ABTS"
627,33164641,"Autophagic flux is a critical cellular process that is vastly under-appreciated in terms of its importance to human health. Preclinical studies have demonstrated that reductions in autophagic flux cause cancer and exacerbate chronic diseases, including heart disease and the pathological hallmarks of dementia. Autophagic flux can be increased by targeting nutrition-related biochemical signaling. To date, translation of this knowledge has been hampered because there has been no way to directly measure autophagic flux in humans. In this study we detail a method whereby human macroautophagic/autophagic flux can be directly measured from human blood samples. We show that whole blood samples can be treated with the lysosomal inhibitor chloroquine, and peripheral blood mononuclear cells isolated from these samples could be used to measure autophagic machinery protein LC3B-II. Blocking of autophagic flux in cells while still in whole blood represents an important advance because it preserves genetic, nutritional, and signaling parameters inherent to the individual. We show this method was reproducible and defined LC3B-II as the best protein to measure autophagic flux in these cells. Finally, we show that this method is relevant to assess intra-individual variation induced by an intervention by manipulating nutrition signaling with an "
628,33165599,Escherichia coli is a leading cause of serious infection among term and preterm newborn infants. Surveillance of antibiotic susceptibility patterns of E coli among infants admitted to neonatal intensive care units should inform empirical antibiotic administration.
629,33165939,"The association of immunoglobulin G (IgG) glycosylation changes with various human diseases and physiological conditions is well established. Since the mechanistical explanation of the regulation of IgG glycosylation and its functional role in these various states is still missing, the eyes of the biomedical community are now turned towards animal models, which enable intervention studies necessary for conclusions on causality. Mice are recognized and used as a good experimental model for human IgG glycosylation. However, smaller blood volumes, low IgG concentrations at young ages (which are most often used in mice experiments) and multiple sampling protocols during the course of longitudinal studies would profit from a robust workflow for mouse IgG glycome analysis from minute amounts of starting material, collected through a simple sampling procedure. For this purpose, we have developed a protocol for analysis of total N-glycans of IgG isolated from mouse dried blood spots (DBS), which we report here. We show that mouse DBS are a good source of material for IgG N-glycan analysis by multiplexed capillary gel electrophoresis with laser-induced fluorescence (xCGE-LIF)."
630,33166242,
