,PMID,abstract
210,31804052,"Metastasis from cutaneous squamous cell carcinoma (cSCC) mainly involve the regional nodal basin, with an incidence ranging from 2-4% until 15% in case of high-risk tumors. When dealing with high-risk cSCC, ultrasound examination is recommended every 3-4 months during follow-up. We aimed to determine the role of US examination in the early diagnosis of nodal metastasis from cSCC."
211,31804054,Epidemiologic studies have shown that cutaneous T-cell lymphoma (CTCL) patients have an increased risk of the development of a second neoplasm (SN). The aim of our study was to evaluate the risk of SN and to correlate any possible change in CTCL course after the diagnosis of a subsequent neoplasm.
212,31804055,"Second primary melanomas (SPMs) are new developed primary melanomas occurring in a subset of patients affected by BRAF-mutated metastatic melanoma during treatment with BRAF-inhibitors. A drug-induced paradoxical activation of mitogen-activated protein kinase (MAPK) signaling pathway in BRAF-wild type/RAS-mutated cells have been proposed as a possible molecular mechanism but data on the mutational status of SPMs are lacking. In order to better understand genetic alterations affecting the biological mechanism of SPMs, we performed a personalized and targeted next-generation sequencing analysis of a patient affected by metastatic melanoma who developed multiple SPMs during treatment with encorafenib (LGX818)."
213,31804389,To evaluate the influence of consensus guidelines on the management of intraductal papillary mucinous neoplasms (IPMN) and the subsequent changes in pathologic outcomes.
214,31807885,"Immunotherapy has improved outcomes for patients with non-small cell lung cancer (NSCLC), yet durable clinical benefit (DCB) is experienced in only a fraction of patients. Here, we test the hypothesis that radiomics features from baseline pretreatment "
215,31808024,"Innovation in ethics pedagogy has continued to evolve and incorporate other forms of storytelling aimed at improving student engagement and learning. The use of bioethics narratives in feature-length films, medical television shows, or short clips in the classroom has a well-established history. In parallel, screenplays present an opportunity for an active approach to ethical engagement. We argue that screenplays and screenwriting provide a rich supplement to current medical ethics teaching and serve as a strong form of reflective learning."
216,31810768,"Regulatory T cells (Tregs) are a promising therapy for several immune-mediated conditions but manufacturing a homogeneous and consistent product, especially one that includes cryopreservation, has been challenging. Discarded pediatric thymuses are an excellent source of therapeutic Tregs with advantages including cell quantity, homogeneity and stability. Here we report systematic testing of activation reagents, cell culture media, restimulation timing and cryopreservation to develop a Good Manufacturing Practice (GMP)-compatible method to expand and cryopreserve Tregs. By comparing activation reagents, including soluble antibody tetramers, antibody-conjugated beads and artificial antigen-presenting cells (aAPCs) and different media, we found that the combination of Dynabeads Treg Xpander and ImmunoCult-XF medium preserved FOXP3 expression and suppressive function and resulted in expansion that was comparable with a single stimulation with aAPCs. Cryopreservation tests revealed a critical timing effect: only cells cryopreserved 1-3 days, but not >3 days, after restimulation maintained high viability and FOXP3 expression upon thawing. Restimulation timing was a less critical process parameter than the time between restimulation and cryopreservation. This systematic testing of key variables provides increased certainty regarding methods for in vitro expansion and cryopreservation of Tregs. The ability to cryopreserve expanded Tregs will have broad-ranging applications including enabling centralized manufacturing and long-term storage of cell products."
217,31813344,"Last minute risk assessment (LMRA) is a well-known work method to support employees' risk perception. However, little is known about the effectiveness of LMRA in providing this support. Here, we describe an eye-tracking experiment with which we attempted to gain more insight into the relationship between LMRA and risk perception and to assess the difference between generic and specific supporting questions. Employees from an international energy production and desalination company participated in this experiment by assessing photographs portraying a (staged) work situation and deciding whether it was safe enough to continue activities and which risk factors were present or absent. The results show a consistent interaction effect over several parameters between work experience and the type of supporting questions, indicating that generic and specific supporting questions should be considered complimentary to each other. Furthermore, the results revealed several other challenges concerning real-world application of the LMRA."
218,31818513,"Burn patients admitted to the hospital with concurrent intoxication are believed to be at an increased risk of poor outcomes and the development of complications, however data varies within the literature and remains controversial. This systematic review and meta-analysis compared outcomes and complications between nicotine/smoking, alcohol, and/or substance use in 26,512 burn patients admitted to the hospital to 299,543 burn patients admitted without these characteristics. The PubMed, EMBASE, Cochrane Library, and Web of Science databases were systematically and independently searched. PRISMA and Cochrane guidelines were strictly followed. Clinical characteristics, nicotine/smoking use, alcohol use, substance use, outcomes and complications were recorded. Seventeen of the 27 studies included in the study, were eligible for meta-analysis, with results from 39 of the possible 84 outcomes and complications. In conclusion, this systematic review and meta-analysis found that compared to non-nicotine/smoking, non-alcohol, non-substance use burn patients, patients using nicotine/smoking, alcohol, and/or substances were associated with more burn related operations, higher rates of graft loss/failure, longer hospital LOS (length of stay), higher rates of intubation, longer ICU (intensive care unit) LOS, increased mortality, and increased wound/local skin infections. Patients using nicotine/smoking were associated with higher rates of intubation and wound/local skin infections. Patients consuming alcohol were associated with more days on a ventilator, had higher rates of intubation, higher rates of inhalation injury, longer ICU LOS, and increased mortality. Patients taking substances were associated with higher %TBSA (percent total body surface area) of burns, longer hospital LOS, higher rates of intubation, higher rates of inhalation injury, longer ICU LOS, and increased wound/local skin infections."
219,31822495,"Germline loss-of-function mutations in BRCA1 interacting protein C-terminal helicase 1 (BRIP1) are associated with ovarian carcinoma and may also contribute to breast cancer risk, particularly among patients who develop disease at an early age. Normal BRIP1 activity is required for DNA interstrand cross-link (ICL) repair and is thus central to the maintenance of genome stability. Although pathogenic mutations have been identified in "
220,31819973,"To evaluate a potential relationship between BRAF V600E mutation and PD-L1 expression, we examined the expression of PD-L1 in pediatric high- and low-grade glioma cell lines as well as a cohort of pediatric low-grade glioma patient samples. Half of the tumors in our patient cohort were V600-wildtype and half were V600E mutant. All tumors expressed PD-L1. In most tumors, PD-L1 expression was low (<5%), but in some cases over 50% of cells were positive. Extent of PD-L1 expression and immune cell infiltration was independent of BRAF V600E mutational status. All cell lines evaluated, including a BRAF V600E mutant xenograft, expressed PD-L1. Transient transfection of cell lines with a plasmid expressing mutant BRAF V600E had minimal effect on PD-L1 expression. These findings suggest that the PD-1 pathway is active in subsets of pediatric low-grade glioma as a mechanism of immune evasion independent of BRAF V600E mutational status. Low-grade gliomas that are unresectable and refractory to traditional therapy are associated with significant morbidity and continue to pose a treatment challenge. PD-1 pathway inhibitors may offer an alternative treatment approach. Clinical trials will be critical in determining whether PD-L1 expression indicates likely therapeutic benefit with immune checkpoint inhibitors."
221,31831512,"An 83-year-old woman presented emergently with a 1-week history of increasing abdominal pain and vomiting. Imaging confirmed an incarcerated incisional hernia containing viable small bowel. Laparotomy revealed profound ischaemic insult extending beyond the hernial contents, affecting virtually the entire small bowel, consistent with acute superior mesenteric artery thrombosis. The patient underwent resection of the entire small bowel except for 20 cm of the jejunum and 15 cm of the terminal ileum. Her duodenum and large bowel were unaffected. Despite her age, comorbidities and only 35 cm of the remnant small bowel, this patient made a remarkable recovery. She transitioned from total parenteral nutrition dependence in an acute hospital setting to being discharged into the community, relying on partial parenteral nutrition two times per week in a home setting."
222,31831513,"An 18-year-old woman with a history of hollow visceral myopathy presented with a small-bowel obstruction. High-dose opioid analgesia was required subsequently during hospital admission. She suffered two episodes of documented fasting hypoglycaemia, despite adjustment of parenteral carbohydrate administration. Investigations for non-insulin-mediated hypoglycaemia revealed a low morning cortisol of 109 nmol/L and an inappropriately low Adrenocorticotropic hormone (ACTH) level of 2.2 pmol/L. A diagnosis of secondary adrenal insufficiency was confirmed on repeat cortisol and ACTH testing. The 250 µg short Synacthen test cortisol response was normal, suggestive of acute rather than chronic ACTH deficiency. This pattern was consistent after further opioid exposure. Adrenal recovery occurred shortly after opioid cessation. Opioid-induced hypoadrenalism is likely an under-recognised clinical entity with potentially serious adverse patient outcomes. There are reported cases involving commonly prescribed opioids including fentanyl and tramadol. However, we believe this is the first reported clinical case of acute transient opioid-induced secondary hypoadrenalism associated with fasting hypoglycaemia."
223,31831514,"Chronic silicosis is an entity widely described in literature. However, other types such as accelerated, acute, complicated and extrapulmonary silicosis are little documented. We present a case of accelerated extrapulmonary silicosis in a lung transplant patient in whom the diagnosis of systemic silicosis was made incidental to non-respiratory complications that occurred during follow-up. The appearance of cytopenia and liver failure led to diagnostic tests that documented the presence of silicotic granulomas in those locations. Taking into account the intensity, time of exposure, onset and development of the disease, we found a highly atypical case of accelerated extrapulmonary silicosis in which inorganic particles (presumably silica) were documented inside granulomas and macrophages of the bone marrow. With these findings, we reflect on the lack of consideration of these entities within clinical practice, their probable under diagnosis and the need to study other pathophysiological mechanisms of acquisition and dissemination of silicosis."
224,31831515,"A 40-year-old man presented with generalised dissociative amnesia. At 2 weeks after onset, N-isopropyl-["
225,31850989,The aim of this study was to investigate the association between preadmission statin use and 90-day mortality after planned elective noncardiac surgery in adult patients.
226,31850990,The aim of this study was to compare patient outcomes between International Medical Graduate (IMG) versus US medical graduate (USMG) surgeons.
227,31851000,"Watch-and-wait approach in rectal cancer relies on the identification of a clinical complete response (CR) after neoadjuvant (chemo)radiotherapy. This is mainly performed by rectal examination, magnetic resonance imaging, and endoscopy. Endoscopy has been less well studied, and the objective of the study is to assess the diagnostic value of endoscopy and the predictive value of endoscopic features for the identification of CR."
228,31855115,
229,31855132,"This prospective cohort study investigated the incidence of lower back pain (LBP) and the risk factors for LBP among university-based office workers. Participants were 159 office workers in one Thailand university who met the inclusion criteria of the cohort group. Data were collected using a follow-up interview questionnaire and measurements of physical fitness and lighting intensity. Results showed that the incidence of LBP during 12-month follow-up was 83.0%. Physical fitness tests showed that the back, leg and hand grip strengths were significantly lower in LBP cases than in non-cases. Multiple logistic regression analysis indicated that the risk factors associated with LBP were body mass index ≤ 25 (adjusted relative risk [RR"
230,31857108,"Eyebrow loss (madarosis) is a frequent sign of frontal fibrosing alopecia (FFA), and it can be the first sign of the disease."
231,31856868,"Breast cancer (BC) is the most common cancer in women, and despite the introduction of new screening programmes, therapies and monitoring technologies, there is still a need to develop more useful tests for monitoring treatment response and to inform clinical decision making. The purpose of this study was to compare circulating cell-free DNA (cfDNA) and circulating tumour cells (CTCs) with conventional breast cancer blood biomarkers (CA15-3 and alkaline phosphatase (AP)) as predictors of response to treatment and prognosis in patients with metastatic breast cancer (MBC)."
232,31858497," Thorax trauma frequently occurs in which injuries to the bony chest, lung contusions (LCs), and others are diagnosed. The significance of this violation is described very differently and is mostly based on monocentric data."
233,31859093,"Burn injury pain is a significant public health problem. Burn injury treatment has improved tremendously in recent decades. However, an unintended consequence is that a larger number of patients now survive more severe injuries, and face intense pain that is very hard to treat. Although many efforts have been made to find alternative treatments, opioids remain the most effective medication available. Burn patients are frequently prescribed opioids in doses and durations that are significantly higher and longer than standard analgesic dosing guidelines. Despite this, many continue to experience unrelieved pain. They are also placed at a higher risk for developing dependence and opioid use disorder. Burn injury profoundly alters the functional state of the immune system. It also alters the expression levels of receptor, effector, and signaling molecules within the spinal cord's dorsal horn. These alterations could explain the reduced potency of opioids. However, recent studies demonstrate that different opioids signal preferentially via differential signaling pathways. This ligand-specific signaling by different opioids implies that burn injury may reduce the antinociceptive potency of opioids to different degrees, in a drug-specific manner. Indeed, recent findings hint at drug-specific differences in the ability of opioids to manage burn pain early after injury, as well as differences in their ability to prevent or treat the development of chronic and neuropathic pain. Here we review the current state of opioid treatment, as well as new findings that could potentially lead to opioid-based pain management strategies that may be significantly more effective than the current solutions."
234,31860549,The aim of this study was to determine whether negative pressure wound therapy (NPWT) applied to primarily closed incisions decreases surgical site infections (SSIs) following open abdominal surgery.
235,31862306,"Physical and emotional burdens impair quality of life (QoL) in many adults with cystic fibrosis (CF). Palliative care (PC) improves QoL in other serious illnesses, yet the full array of palliative needs amenable to PC are unknown in CF."
236,31865892,"To explore mental workload and methods for dynamically monitoring mental workload imposed by complex tasks, this study constructed a virtual operating environment according to three cognitive steps: perception, judgment-making and action execution. Dynamic characteristics of mental workload were then analyzed employing subjective questionnaires, performance data and electroencephalography (EEG) characteristics. The analysis of non-linear dynamic characteristics of EEG signals showed that the fractal box dimension features of EEG signals are quite sensitive to the level of mental workload, exercising a significant impact on the four brain areas. The sample entropy is also quite sensitive to the level of mental workload, exercising a significant impact on the frontal, central and occipital areas. Based on this study, operational tasks can be dynamically assigned according to the state of personnel load and the safety and efficiency of the operation of the human-machine system can be ensured."
237,31870915,"Metastatic basal cell carcinoma (mBCC) is a very rare entity, and diagnosis can be challenging. Therapeutic options are limited, and response to targeted therapy is poor."
238,31875881,"A great deal of neuroimaging research focuses on voxel-wise analysis or segmentation of damaged tissue, yet many diseases are characterized by diffuse or non-regional neuropathology. In simple cases, these processes can be quantified using summary statistics of voxel intensities. However, the manifestation of a disease process in imaging data is often unknown, or appears as a complex and nonlinear relationship between the voxel intensities on various modalities. When the relevant pattern is unknown, summary statistics are often unable to capture differences between disease groups, and their use may encourage post hoc searches for the optimal summary measure. In this study, we introduce the multi-modal density testing (MMDT) framework for the naive discovery of group differences in voxel intensity profiles. MMDT operationalizes multi-modal magnetic resonance imaging (MRI) data as multivariate subject-level densities of voxel intensities and utilizes kernel density estimation to develop a local two-sample test for individual points within the density space. Through simulations, we show that this method controls type I error and recovers relevant differences when applied to a specified point. Additionally, we demonstrate the ability to maintain power while controlling the family-wise error rate and false discovery rate when applying the test over a grid of points within the density space. Finally, we apply this method to a study of subjects with either multiple sclerosis (MS) or conditions that tend to mimic MS on MRI, and find significant differences between the two groups in their voxel intensity profiles within the thalamus."
239,31883840,"Regulatory T cells (Tregs) subdue immune responses. Central to Treg activation are changes in lipid metabolism that support their survival and function. Fatty acid binding proteins (FABPs) are a family of lipid chaperones required to facilitate uptake and intracellular lipid trafficking. One family member, FABP5, is expressed in T cells, but its function remains unclear. We show that in Tregs, genetic or pharmacologic inhibition of FABP5 function causes mitochondrial changes underscored by decreased OXPHOS, impaired lipid metabolism, and loss of cristae structure. FABP5 inhibition in Tregs triggers mtDNA release and consequent cGAS-STING-dependent type I IFN signaling, which induces heightened production of the regulatory cytokine IL-10 and promotes Treg suppressive activity. We find evidence of this pathway, along with correlative mitochondrial changes in tumor infiltrating Tregs, which may underlie enhanced immunosuppression in the tumor microenvironment. Together, our data reveal that FABP5 is a gatekeeper of mitochondrial integrity that modulates Treg function."
240,31893965,The purpose of this study was to develop a body volume (
241,31895709,We sought to determine whether postoperative chemotherapy after preoperative therapy and pancreatectomy for pancreatic ductal adenocarcinoma (PDAC) prolongs survival.
242,31897996,"Despite the association of physical activity with improved cardiovascular outcomes and the association of high coronary artery calcification (CAC) scores with poor prognosis, elite endurance athletes have increased CAC. Yet, they nevertheless have better cardiovascular survival. We hypothesized that exercise may transform vascular calcium deposits to a more stable morphology."
243,31898004,"Hybrid PET/MR imaging has significant potential in cardiology due to its combination of molecular PET imaging and cardiac MR. Multi-tissue-class MR-based attenuation correction (MRAC) is necessary for accurate PET quantification. Moreover, for thoracic PET imaging, respiration is known to lead to misalignments of MRAC and PET data that result in PET artifacts. These factors can be addressed by using multi-echo MR for tissue segmentation and motion-robust or motion-gated acquisitions. However, the combination of these strategies is not routinely available and can be prone to errors. In this study, we examine the qualitative and quantitative impacts of multi-class MRAC compared to a more widely available simple two-class MRAC for cardiac PET/MR."
244,31905028,"Cerebellar slump is a rarely reported complication of craniocervical decompression for Chiari malformation. This is known to occur following an oversized bony decompression of the cranio-vertebral junction. The index case is the first reported which developed this phenomenon following cerebellar hemispheric haematoma removal. Disturbance of CSF circulation in the presence of a calvarial defect may have been the cause. The patient was treated with a titanium mesh cranioplasty of the posterior cranial defect, followed by a ventriculo-peritoneal shunt."
245,31914889,"Construction workers regularly experience heavy workloads and various physical stressors that can result in work-related musculoskeletal disorders (WRMSDs). According to the Bureau of Labor Statistics, construction glass and glazing (CGG) workers had a higher rate of injuries and illnesses than the national average for all occupations. In 2010, CGG contractors presented the highest rate of back injuries reported by the Center for Construction Research and Training. This study aimed to develop a detailed job description that includes the CGG definition, tasks, activities and work conditions. A qualitative case study was conducted, and data were collected through CGG workers' interviews and observations. This information is not currently available in government publications, published research or job training materials for CGG workers and contractors. The results of this study can help facilitate the ergonomics analysis in future studies to eliminate or reduce the risk of WRMSDs in CGG work."
246,31918578,Online electronic records such as patient portals and personally controlled electronic health records (PEHRs) have been widely viewed as a key component to modernising the delivery of healthcare but the uptake of such systems has been slow.
247,31928787,"The prevalence of self-immolation is significantly higher in some Middle Eastern and Central Asian Islamic countries than in Western countries. Self-immolation typically occurs among females and can be either an attempt at suicide or an act of protest. This systematic review examined the drivers and consequences of self-immolation in Asian Islamic countries from the perspective of those affected by it, including survivors, family and health care staff in order to understand its higher prevalence in these countries."
248,31961647,"Biologically inspired structural color hydrogels with magnetic- and photothermal-controlled self-healable abilities were fabricated by integrating magnetic-responsive photonic crystals into gelatin hydrogels. The self-healable ability of the hydrogel systems was derived from the magnetic response and light-absorbing abilities of the magnetic nanoparticles. When the hydrogels deteriorate or get damaged, magnetic nanoparticles could absorb heat under near-infrared irradiation and external magnetic fields, which stimulates phase transformation in the hydrogels to fill or heal the hydrogels. In addition, the hydrogel systems were demonstrated with high biocompatibility and plasticity. These features of magnetic self-healable structural color hydrogels make them have broad application prospects in the fields of biological engineering and cell engineering."
