,PMID,abstract
0,20868729,"Sonic hedgehog (Shh) and Wnt-7a are morphogens involved in embryonic as well as ongoing adult neurogenesis. Their effects on the differentiation and membrane properties of neonatal neural stem/progenitor cells (NS/PCs) were studied in vitro using NS/PCs transduced with either Shh or Wnt-7a. Eight days after the onset of in vitro differentiation the cells were analyzed for the expression of neuronal and glial markers using immunocytochemical and Western blot analysis, and their membrane properties were characterized using the patch-clamp technique. Our results showed that both Shh and Wnt-7a increased the numbers of cells expressing neuronal markers; however, quantitative immunocytochemical analysis showed that only Wnt-7a enhanced the outgrowth and the development of processes in these cells. In addition, Wnt-7a markedly suppressed gliogenesis. The electrophysiological analysis revealed that Wnt-7a increased, while Shh decreased the incidence of cells displaying a neuron-like current pattern, represented by outwardly rectifying K(+) currents and tetrodotoxin-sensitive Na(+) currents. Additionally, Wnt-7a increased cell proliferation only at the early stages of differentiation, while Shh promoted proliferation within the entire course of differentiation. Thus we can conclude that Shh and Wnt-7a interfere differently with the process of neuronal differentiation and that they promote distinct stages of neuronal differentiation in neonatal NS/PCs."
1,12657199,"We report the first application and usefulness of image transfer through a mobile telephone, which can be used between the hospital and another location."
2,19756885,"Cardiac tissue-engineering research is focused on the development of functional three-dimensional (3D) heart muscle in vitro. These models allow the detailed study of critical events in organogenesis, such as the establishment of cell-cell communication and construction and modification of the extracellular matrix. We have previously described a model for 3D heart muscle, termed cardioids, formed by the spontaneous delamination of a cohesive monolayer of primary cells in the absence of any synthetic scaffolding material. In an earlier publication, we have shown that, upon electrical stimulation, cardioids generate a twitch force in the range of 200-300 microN, generate a specific force (twitch force normalized to total cross-sectional area) of 2-4 kN/m(2), and can be electrically paced at frequencies of up to 10 Hz without any notable fatigue. We have two objectives for the current study: model development and model optimization. Our model development efforts are focused on providing additional characterization of the cardioid model. In this study, we show for the first time that cardioids show a pattern of gene expression comparable to that of cells cultured in two dimensions on tissue culture plastic and normal mammalian heart muscle. Compared with primary cardiac cells cultured on tissue culture plastic, the expression of alpha-myosin heavy chain (MHC), beta-MHC, SERCA2, and phospholamban was significantly higher in cardioids. Our second objective, model optimization, is focused on evaluating the effect of several cell culture variables on cardioid formation and function. Specifically, we looked at the effect of plating density (1.0-4.0 x 10(6) cells per cardioid), concentration of two adhesion proteins (laminin at 0.2-2.0 microg/cm(2) and fibronectin at 1-10 microg/cm(2)), myocyte purity (using preplating times of 15 and 60 min), and ascorbic acid stimulation (1-100 microl/ml). For our optimization studies, we utilized twitch force in response to electrical stimulation as our endpoint metric. Based on these studies, we found that cardioids formed with a plating density in the range 3-4 x 10(6) cells per cardioid generated the maximum twitch force, whereas increasing the surface adhesion protein (using either laminin or fibronectin) and increasing the myocyte purity both resulted in a decrease in twitch force. In addition, increasing the ascorbic acid concentration resulted in an increase in the baseline force of cardioids, which was recorded in the absence of electrical stimulation. Based on the model development studies, we have shown that cardioids do indeed exhibit a gene expression pattern similar to normal mammalian heart muscle. This provides further validity for the cardioid model. Based on the model optimization studies, we have identified specific cell culture regimes which support cardioid formation and function. These results are specific to the cardioid model; however, they may be translated and applied to other tissue-engineering models. Collectively, the work described in this study provides insight into the formation of functional 3D heart muscle and the effect of several cell culture variables on tissue formation and function."
3,18254011,"Nasal continuous positive airway pressure (NCPAP) is used to support preterm infants recently extubated, those experiencing significant apnoea of prematurity and those with respiratory distress soon after birth as an alternative to intubation and ventilation. This review focuses exclusively on identifying the most effective pressure source and interface for NCPAP delivery in preterm infants."
4,21480395,"Tobacco is notably genotoxic and associated with head and neck carcinogenesis. Cigarette carcinogens have the capacity to alter early response gene expression in tobacco-related malignancies via genes such as nuclear factor kappa B (NFκB). A number of early response gene activation events are also facilitated by fos/jun activator protein 1 (AP-1) associated pathways. In the present study, we hypothesize that tobacco products may induce microenvironment alterations, promoting angiogenesis and providing a permissive environment for head and neck cancer progression. In an in vitro analysis, we employed immortalized oral keratinocyte (HOK-16B) and laryngeal squamous carcinoma (UM-SCC-11A) cells to investigate interleukin (IL)-8 and vascular endothelial growth factor (VEGF) induction by cigarette smoke condensate (CSC). IL-8 and VEGF expression is based on interactions between NFκB, AP-1, and NF-IL6. We identified at least 1.5-fold dose-dependent induction of AP-1, VEGF, and IL-8 promoter/reporter gene activity after 24 h exposure to CSC. Next, we stably transfected UM-SCC-11A cells with A-Fos, a dominant negative AP-1 protein. Treatment with CSC of the A-Fos cell lines compared to empty vector controls significantly down-regulated AP-1, VEGF, and IL-8 promoter/reporter gene expression. We also performed ELISAs and discovered significant up-regulation of IL-8 and VEGF secretion by UMSCC 11A after treatment with phorbol 12-myristate 13-acetate, tumor necrosis factor alpha, and CSC, which was down-regulated by the A-Fos dominant negative protein. We conclude tobacco carcinogens up-regulate AP-1 activity and AP-1 dependent IL-8 and VEGF gene expression in head and neck cancer. This up-regulation may promote an angiogenic phenotype favoring invasion in both premalignant and squamous cancer cells of the head and neck."
5,23070062,Individuals with serious mental illness have elevated rates of comorbid chronic general medical conditions and may benefit from interventions designed to support illness self-management. This study examined the effectiveness of a modified version of the Chronic Disease Self-Management Program called Living Well for individuals with serious mental illness.
6,24182692,"There is not much level 1 evidence based literature to guide management of hypertrophic scars and keloids despite an array of therapeutic modalities at disposal. Intralesional (i/l) triamcinolone injections have remained a gold standard in non surgical management. Sporadic reports on use of i/l verapamil suggest its efficacy. Since verapamil has not found sufficient mention as an effective alternative modality, it was decided to undertake a randomized study which could also address some additional clinical parameters. A randomized, parallel group and observer blinded comparison with 40 patients (48 scars) was carried out to compare the effects of i/l triamcinolone (T) (22 scars) and verapamil injections (V) (26 scars). 1.5 ml was the maximum indicative volume decided in the study protocol for both the drugs (triamcinolone @40 mg/ml and verapamil @ 2.5 mg/ml). Patients included were aged between 15-60 years with scars ranging between 0.5-5 cm (but total area roughly <6 cm(2)), and scars under 2 years duration. Patients with keloidal diathesis were excluded. Injections were scheduled every three weeks until complete flattening of the scar or eight sessions, which ever came earlier. No concomitant therapies like massage, silicone gel or pressure garments were used. Scar evaluation at each stage was done by serial photographic records as well as by Vancouver Scar Scale (VSS). Comparative survival analysis between the two drugs was done using Kaplan Meier curves, and VSS scores were analyzed using Wilcoxon test and log rank test. Mean zero VSS scores were achieved with treatments in respect of scar height (T-12 weeks, V-21 weeks), vascularity (T-15 weeks, V-18 weeks) and pliability (T-15 weeks, V-21 weeks). The improvement in scar vascularity and pliability kept pace with decrease in scar height, in both the groups. There was not much difference in the rate of change of scar pigmentation with either drug but almost 60% patients in both the groups regained normal pigmentation. Our study adds to evidence of verapamil's capability in flattening the raised scars. With an extremely low cost and fewer adverse effects it deserves better positioning in the wide armamentarium against hypertrophic scars. It also offers several therapeutic possibilities to alternate with triamcinolone or be used simultaneously in larger (or multiple) scars."
7,24654939,To analyze the effect of various coating formulations on the mechanical and corrosion properties of nickel-titanium (NiTi) orthodontic wires.
8,24654941,To evaluate the short- and long-term treatment results of rapid maxillary expansion (RME) and surgical assistance during maxillary protraction with a facemask (FM).
9,24399641,Psychological and educational interventions have been used as an adjunct to conventional therapy for children with atopic eczema to enhance the effectiveness of topical therapy. This is an update of the original Cochrane review.
10,24665865,To evaluate the diagnostic accuracy and repeatability of the visual assessment of the cervical vertebral maturation (CVM) stages.
11,24665886,"To compare the clinical performance of brackets bonded to anterior and posterior teeth, including second molars."
12,24665887,To evaluate treatment and posttreatment dentoskeletal effects induced by the Forsus device (FRD) in growing patients with Class II malocclusion in a retrospective controlled clinical study.
13,24665888,To test the null hypothesis that there were no significant differences for pharyngeal airway volumes between the adolescent patients affected by bilateral cleft lip and palate (BCLP) and well-matched controls using cone beam computed tomography.
14,24673657,To investigate the perception of facial asymmetry in young adults to identify the amounts of chin asymmetry that can be regarded as normal and may benefit from correction.
15,24673658,To investigate dentofacial characteristics of orthodontic patients with centric relation (CR)-maximum intercuspation (MI) discrepancy and to analyze changes in dentofacial characteristics between CR and MI positions in these patients using lateral cephalograms.
16,24665889,To evaluate the effect of different lubricants on friction between orthodontic brackets and archwires.
17,24694014,To investigate the time course of osteocyte death in a mouse model of orthodontic tooth movement (OTM) and its association to the caspase-3 activation pathway and osteoclast formation.
18,24694015,To investigate whether there is evidence to support the association between cortical thickness (CtTh) and the primary stability of mini-implants (MI).
19,24694016,To evaluate the relationship between pretreatment case complexity and orthodontic treatment outcomes.
20,24713070,To evaluate the condylar changes through cone-beam computed tomography (CBCT) images in patients treated with Twin-Block functional appliance.
21,24731061,To compare the effect of secondary alveolar bone graft (SABG) on the tooth development stage of the maxillary central incisor (MXCI) and maxillary canine (MXC) in terms of the severity of unilateral cleft.
22,24731062,"To evaluate the effect of different bracket types on the levels of Streptococcus mutans (SM) and Lactobacillus (LB) in saliva, in plaque, and on the periodontal condition."
23,24731063,"To investigate the effect of Lithothamnium sp (LTT) supplement, a calcium-rich alga widely used for mineral reposition, on strain-induced (orthodontic tooth movement [OTM]) and infection-induced bone resorption (periodontal disease [PD]) in mice."
24,24738791,To investigate the effects of third-order torque on frictional properties of self-ligating brackets (SLBs).
25,24745629,"To clarify the reproducibility of a tentative method for identifying maxillofacial landmarks on three-dimensional (3D) images obtained with cone-beam computed tomography (CBCT) for dental use in patients with mandibular prognathism. Also, the influence of level of experience of dentists applying the method was investigated by dividing them into two groups according to experience."
26,24754797,To investigate differences in the amount of tooth movement and root resorption that occurred after tipping and bodily movement of the maxillary first molar in rats.
27,24762046,To evaluate the impact of the first 8 months of orthodontic treatment with a fixed appliance on the families of adolescent patients and to examine the evaluative properties of the Family Impact Scale (FIS).
28,24773221,To assess the association between formation stages of the mandibular third molars and the space distal to the permanent molars (retromolar space).
29,24784844,To compare the following over a period of 8 weeks: (1) force decay between thermoplastic (TP) and thermoset (TS) elastomeric chains; (2) force decay between light (200-g) and heavy (350-g) initial forces; and (3) force decay between direct chains and chain loops (stretched from one pin around the second pin and back to the first pin).
30,24813300,"Mohs micrographic surgery (MMS) is an effective treatment for skin cancer. Until recently, it has been difficult to determine the percentage of skin cancers best treated with MMS. The appropriate-use criteria represents an opportunity to more accurately estimate this number."
31,24813325,"To compare bond strength and bond failure location of lingual brackets indirectly bonded after lingual enamel sandblasting with 27-, 50-, and 90-µm aluminum oxide particles followed by 37% phosphoric acid etching."
32,25238327,"Guillain-Barré syndrome (GBS) is an acute, paralysing, inflammatory peripheral nerve disease. Intravenous immunoglobulin (IVIg) is beneficial in other autoimmune diseases. This is an update of a review first published in 2001 and previously updated in 2003, 2005, 2007, 2010 and 2012. Other Cochrane systematic reviews have shown that plasma exchange (PE) significantly hastens recovery in GBS compared with supportive treatment alone, and that corticosteroids alone are ineffective."
33,25318966,"Pharmaceuticals are important interventions that could improve people's health. Pharmaceutical pricing and purchasing policies are used as cost-containment measures to determine or affect the prices that are paid for drugs. Internal reference pricing establishes a benchmark or reference price within a country which is the maximum level of reimbursement for a group of drugs. Other policies include price controls, maximum prices, index pricing, price negotiations and volume-based pricing."
34,25321859,"This is an update of the review on ""Lidocaine for pain relief in burn injured patients"" first published in Issue 3, 2007, and first updated in 2012. Pain is a major issue for people with many different types of wounds, in particular those people with burn injuries. Prompt, aggressive use of opioid analgesics such as morphine has been suggested as critical to avert the cycle of pain and anxiety, but adverse effects are encountered. It has been proposed that newer agents such as lidocaine could be effective in reducing pain and alleviating the escalating opioid dosage requirements in people with burn injury."
35,25829028,"This is an updated version of the original Cochrane review published in 2005 on selective serotonin reuptake inhibitors (SSRIs) for preventing migraine and tension-type headache. The original review has been split in two parts and this review now only regards migraine prevention. Another updated review is under development to cover tension-type headache.Migraine is a common disorder. The chronic forms are associated with disability and have a high economic impact. In view of discoveries about the role of serotonin and other neurotransmitters in pain mechanisms, selective serotonin reuptake inhibitors (SSRIs) and serotonin-norepinephrine reuptake inhibitors (SNRIs) have been evaluated for the prevention of migraine."
36,26690497,"Hypoxaemia during labour can alter the shape of the fetal electrocardiogram (ECG) waveform, notably the relation of the PR to RR intervals, and elevation or depression of the ST segment. Technical systems have therefore been developed to monitor the fetal ECG during labour as an adjunct to continuous electronic fetal heart rate monitoring with the aim of improving fetal outcome and minimising unnecessary obstetric interference."
37,26801659,"Ovarian cancer is the third most common gynaecological cancer worldwide, with an age-standardised incidence rate of 6.1 per 10,000 women. Standard therapy for advanced epithelial ovarian cancer (EOC) includes a combination of cytoreductive surgery and platinum-based chemotherapy. Cytoreductive surgery aims to remove as much of the visible tumour as possible. As extensive intraperitoneal metastases are typical of advanced EOC, cytoreductive surgery is usually an extensive procedure with the risk of excessive bleeding. Tranexamic acid given perioperatively is effective in reducing blood loss and allogeneic blood transfusion requirements in a variety of surgical settings. Therefore, tranexamic acid seems to be a promising agent for minimising blood loss and the need for blood transfusion among women with advanced EOC undergoing cytoreductive surgery."
38,26824178,"The objective of this study was to develop a computational fluid dynamics (CFD) model to predict the deposition, dissolution, clearance, and absorption of pharmaceutical particles in the human nasal cavity."
39,26850728,"Spinal cord edema is a serious complication and pathophysiological change after ischemia reperfusion (IR) injury. It has been demonstrated closely associated with bimodal disruption of blood-spinal cord barrier (BSCB) in our previous work. Aquaporin (AQP)1 plays important but contradictory roles in water homeostasis. Recently, microRNAs (miRs) effectively regulate numerous target mRNAs during ischemia. However, whether miRs are able to protect against dimodal disruption of BSCB by regulating perivascular AQP1 remains to be elucidated."
40,26935713,"Blood pressure is a commonly measured risk factor for non-fatal and fatal cardiovascular adverse events such as heart attacks and strokes. Clinical trials have suggested that coenzyme Q10, a non-prescription nutritional supplement, can effectively lower blood pressure (BP). When this review was completed and published in October 2009, it concluded that ""due to the possible unreliability of the 3 included studies, it is uncertain whether or not coenzyme Q10 reduces blood pressure in the long-term management of primary hypertension."""
41,26961574,Beta blockers are commonly used to treat hypertension. The blood pressure reading is the primary tool for physicians and patients to assess the efficacy of the treatment. The blood pressure lowering effect of beta-1 selective blockers is not known.
42,27012320,"In areas where vitamin A deficiency (VAD) is a public health concern, the maternal dietary intake of vitamin A may be not sufficient to meet either the maternal nutritional requirements, or those of the breastfed infant, due the low retinol concentrations in breast milk."
43,27022888,"Melatonin is an antioxidant with anti-inflammatory and anti-apoptotic effects. Animal studies have supported a fetal neuroprotective role for melatonin when administered maternally. It is important to assess whether melatonin, given to the mother, can reduce the risk of neurosensory disabilities (including cerebral palsy) and death, associated with fetal brain injury, for the preterm or term compromised fetus."
44,27030541,"Early rehospitalization after an episode of acute heart failure (AHF) remains excessively high and its prediction a contemporary challenge. Iron deficiency (ID) is a frequent finding in AHF, but its prognostic implications remain unclear. We sought to evaluate the association between ID and risk of 30-day readmission in an unselected cohort of patients discharged for AHF."
45,27045603,"Ganoderma lucidum is a natural medicine that is widely used and recommended by Asian physicians and naturopaths for its supporting effects on immune system. Laboratory research and a handful of preclinical trials have suggested that G. lucidum carries promising anticancer and immunomodulatory properties. The popularity of taking G. lucidum as an alternative medicine has been increasing in cancer patients. However, there is no systematic review that has been conducted to evaluate the actual benefits of G. lucidum in cancer treatment."
46,27045604,Policies and protocols vary widely for fetal surveillance in a pregnancy where the fetus is suspected to be large-for-gestational-age (LGA). All ultimately culminate in decisions about the mode and timing of birth. LGA is known to be associated with increased risks to both the mother and baby. Interventions based on surveillance regimen findings may be associated with risks to the mother and baby.
47,27087257,"Asthma remains a significant cause of avoidable morbidity and mortality. Regular check-ups with a healthcare professional are essential to monitor symptoms and adjust medication.Health services worldwide are considering telephone and internet technologies as a way to manage the rising number of people with asthma and other long-term health conditions. This may serve to improve health and reduce the burden on emergency and inpatient services. Remote check-ups may represent an unobtrusive and efficient way of maintaining contact with patients, but it is uncertain whether conducting check-ups in this way is effective or whether it may have unexpected negative consequences."
48,27087494,"Primary dysmenorrhoea is the most common form of period pain and affects up to three-quarters of women at some stage of their reproductive life. Primary dysmenorrhoea is pain in the absence of any organic cause and is characterised by cramping pain in the lower abdomen, starting within the first eight to 72 hours of menstruation.This review examines the currently available evidence supporting the use of acupuncture (stimulation of points on the body using needles) and acupressure (stimulation of points on the body using pressure) to treat primary dysmenorrhoea."
49,27144417,Recent advances in deep amplicon sequencing have enabled rapid assessment of somatic mutations and structural changes in multiple cancer genes in DNA isolated from tumour tissues and circulating cell-free DNA (cfDNA). This cfDNA is under investigation as a 'liquid biopsy' for the real time monitoring of patients with cancer in a growing number of research studies and clinical trials.
50,27356090,"Ovarian cancer is seventh most common cancer in women worldwide. Approximately 1.3% of women will be diagnosed with ovarian cancer at some point during their life time. The majority of tumours arise from surface of the ovary (epithelial). Two thirds of these women will present with advanced disease, requiring aggressive treatment, which includes debulking surgery (removal of as much disease as possible) and chemotherapy. However, most women (75%) with advanced epithelial ovarian cancer (EOC) will relapse following surgery and chemotherapy. Patients who relapse are treated with either platinum or non-platinum drugs and this is dependent on the platinum-sensitivity and platinum-free interval. These drug regimens are generally well-tolerated although there are potential severe side effects. New treatments that can be used to treat recurrence or prevent disease progression after first-line or subsequent chemotherapy are important, especially those with a low toxicity profile. Hormones such as luteinising hormone releasing hormone (LHRH) agonists have been used in the treatment of relapsed EOC. Some studies have shown objective remissions, while other studies have shown little or no benefit. Most small studies report a better side-effect profile for LHRH agonists when compared to standard chemotherapeutic agents used in EOC."
51,27398809,"Candida bloodstream infections most often affect those already suffering serious, potentially life-threatening conditions and often cause significant morbidity and mortality. Most affected persons have a central venous catheter (CVC) in place. The best CVC management in these cases has been widely debated in recent years, while the incidence of candidaemia has markedly increased."
